[INFO] Scanning for projects...
[INFO] 
[INFO] --------------------< com.sweetshop:sweet-shop-api >--------------------
[INFO] Building sweet-shop-api 0.0.1-SNAPSHOT
[INFO]   from pom.xml
[INFO] --------------------------------[ jar ]---------------------------------
[INFO] 
[INFO] --- resources:3.3.1:resources (default-resources) @ sweet-shop-api ---
[INFO] Copying 1 resource from src\main\resources to target\classes
[INFO] Copying 0 resource from src\main\resources to target\classes
[INFO] 
[INFO] --- compiler:3.13.0:compile (default-compile) @ sweet-shop-api ---
[INFO] Recompiling the module because of added or removed source files.
[INFO] Compiling 9 source files with javac [debug parameters release 21] to target\classes
[INFO] 
[INFO] --- resources:3.3.1:testResources (default-testResources) @ sweet-shop-api ---
[INFO] skip non existing resourceDirectory C:\Users\SAILISH THAKUR\Desktop\codes\ASSESSMENT\sweet-shop-api\src\test\resources
[INFO] 
[INFO] --- compiler:3.13.0:testCompile (default-testCompile) @ sweet-shop-api ---
[INFO] Recompiling the module because of changed dependency.
[INFO] Compiling 2 source files with javac [debug parameters release 21] to target\test-classes
[INFO] 
[INFO] --- surefire:3.5.2:test (default-test) @ sweet-shop-api ---
[INFO] Using auto detected provider org.apache.maven.surefire.junitplatform.JUnitPlatformProvider
[INFO] 
[INFO] -------------------------------------------------------
[INFO]  T E S T S
[INFO] -------------------------------------------------------
[INFO] Running com.sweetshop.api.controller.SweetControllerTest
20:32:21.725 [main] INFO org.springframework.test.context.support.AnnotationConfigContextLoaderUtils -- Could not detect default configuration classes for test class [com.sweetshop.api.controller.SweetControllerTest]: SweetControllerTest does not declare any static, non-private, non-final, nested classes annotated with @Configuration.
20:32:21.921 [main] INFO org.springframework.boot.test.context.SpringBootTestContextBootstrapper -- Found @SpringBootConfiguration com.sweetshop.api.SweetShopApiApplication for test class com.sweetshop.api.controller.SweetControllerTest

  .   ____          _            __ _ _
 /\\ / ___'_ __ _ _(_)_ __  __ _ \ \ \ \
( ( )\___ | '_ | '_| | '_ \/ _` | \ \ \ \
 \\/  ___)| |_)| | | | | || (_| |  ) ) ) )
  '  |____| .__|_| |_|_| |_\__, | / / / /
 =========|_|==============|___/=/_/_/_/

 :: Spring Boot ::                (v3.4.0)

2025-12-13T20:32:22.433+05:30  INFO 19888 --- [sweet-shop-api] [           main] c.s.api.controller.SweetControllerTest   : Starting SweetControllerTest using Java 24.0.2 with PID 19888 (started by SAILISH THAKUR in C:\Users\SAILISH THAKUR\Desktop\codes\ASSESSMENT\sweet-shop-api)
2025-12-13T20:32:22.434+05:30 DEBUG 19888 --- [sweet-shop-api] [           main] c.s.api.controller.SweetControllerTest   : Running with Spring Boot v3.4.0, Spring v6.2.0
2025-12-13T20:32:22.435+05:30  INFO 19888 --- [sweet-shop-api] [           main] c.s.api.controller.SweetControllerTest   : No active profile set, falling back to 1 default profile: "default"
2025-12-13T20:32:24.411+05:30  WARN 19888 --- [sweet-shop-api] [           main] .s.s.UserDetailsServiceAutoConfiguration : 

Using generated security password: 3bd92d6d-47dc-443b-9e89-f978845c1394

This generated password is for development use only. Your security configuration must be updated before running your application in production.

2025-12-13T20:32:24.439+05:30  INFO 19888 --- [sweet-shop-api] [           main] r$InitializeUserDetailsManagerConfigurer : Global AuthenticationManager configured with UserDetailsService bean with name inMemoryUserDetailsManager
2025-12-13T20:32:24.635+05:30  INFO 19888 --- [sweet-shop-api] [           main] o.s.b.t.m.w.SpringBootMockServletContext : Initializing Spring TestDispatcherServlet ''
2025-12-13T20:32:24.635+05:30  INFO 19888 --- [sweet-shop-api] [           main] o.s.t.web.servlet.TestDispatcherServlet  : Initializing Servlet ''
2025-12-13T20:32:24.637+05:30  INFO 19888 --- [sweet-shop-api] [           main] o.s.t.web.servlet.TestDispatcherServlet  : Completed initialization in 2 ms
2025-12-13T20:32:24.666+05:30  INFO 19888 --- [sweet-shop-api] [           main] c.s.api.controller.SweetControllerTest   : Started SweetControllerTest in 2.661 seconds (process running for 3.714)

MockHttpServletRequest:
      HTTP Method = POST
      Request URI = /api/sweets
       Parameters = {}
          Headers = [Content-Type:"application/json", Content-Length:"75"]
             Body = <no character encoding set>
    Session Attrs = {}

Handler:
             Type = org.springframework.web.servlet.resource.ResourceHttpRequestHandler

Async:
    Async started = false
     Async result = null

Resolved Exception:
             Type = org.springframework.web.servlet.resource.NoResourceFoundException

ModelAndView:
        View name = null
             View = null
            Model = null

FlashMap:
       Attributes = null

MockHttpServletResponse:
           Status = 404
    Error message = No static resource api/sweets.
          Headers = [Vary:"Origin", "Access-Control-Request-Method", "Access-Control-Request-Headers"]
     Content type = null
             Body = 
    Forwarded URL = null
   Redirected URL = null
          Cookies = []
[ERROR] Tests run: 1, Failures: 1, Errors: 0, Skipped: 0, Time elapsed: 3.325 s <<< FAILURE! -- in com.sweetshop.api.controller.SweetControllerTest
[ERROR] com.sweetshop.api.controller.SweetControllerTest.shouldCreateSweet -- Time elapsed: 0.184 s <<< FAILURE!
java.lang.AssertionError: Status expected:<201> but was:<404>
	at org.springframework.test.util.AssertionErrors.fail(AssertionErrors.java:61)
	at org.springframework.test.util.AssertionErrors.assertEquals(AssertionErrors.java:128)
	at org.springframework.test.web.servlet.result.StatusResultMatchers.lambda$matcher$9(StatusResultMatchers.java:640)
	at org.springframework.test.web.servlet.MockMvc$1.andExpect(MockMvc.java:214)
	at com.sweetshop.api.controller.SweetControllerTest.shouldCreateSweet(SweetControllerTest.java:55)
	at java.base/java.lang.reflect.Method.invoke(Method.java:565)
	at java.base/java.util.ArrayList.forEach(ArrayList.java:1604)
	at java.base/java.util.ArrayList.forEach(ArrayList.java:1604)

[INFO] 
[INFO] Results:
[INFO] 
[ERROR] Failures: 
[ERROR]   SweetControllerTest.shouldCreateSweet:55 Status expected:<201> but was:<404>
[INFO] 
[ERROR] Tests run: 1, Failures: 1, Errors: 0, Skipped: 0
[INFO] 
[INFO] ------------------------------------------------------------------------
[INFO] BUILD FAILURE
[INFO] ------------------------------------------------------------------------
[INFO] Total time:  6.779 s
[INFO] Finished at: 2025-12-13T20:32:24+05:30
[INFO] ------------------------------------------------------------------------
[ERROR] Failed to execute goal org.apache.maven.plugins:maven-surefire-plugin:3.5.2:test (default-test) on project sweet-shop-api: There are test failures.
[ERROR] 
[ERROR] See C:\Users\SAILISH THAKUR\Desktop\codes\ASSESSMENT\sweet-shop-api\target\surefire-reports for the individual test results.
[ERROR] See dump files (if any exist) [date].dump, [date]-jvmRun[N].dump and [date].dumpstream.
[ERROR] -> [Help 1]
[ERROR] 
[ERROR] To see the full stack trace of the errors, re-run Maven with the -e switch.
[ERROR] Re-run Maven using the -X switch to enable full debug logging.
[ERROR] 
[ERROR] For more information about the errors and possible solutions, please read the following articles:
[ERROR] [Help 1] http://cwiki.apache.org/confluence/display/MAVEN/MojoFailureException
